{
  "employee": {
    "salutation": "Ms.",
    "givenName": "Sarah",
    "surname": "Johnson",
    "phoneNumber": {
      "countryCode": "+1",
      "localNumber": "4155551234"
    },
    "employeeID": "EMP-2024-SF-00847",
    "email": "sarah.johnson@globaltravel.com",
    "jobTitle": "Senior Travel Consultant",
    "pcc": ["SFO1A2", "LAX3B4", "NYC5C6"]
  },
  "iss": "https://credentials.iata.org/issuer",
  "iat": 1731859200,
  "exp": 1763395200,
  "vct": "https://iata.org/.well-known/vct/travel_agency_employee",
  "cnf": {
    "jwk": {
      "kty": "EC",
      "crv": "P-256",
      "x": "u2gFfkNR6nMfApDwvDXrsrkzo7a_TaENwG147wvgSQM",
      "y": "-3BXm0k-5beaQ2OUOBctDD-2vTKGdLYW5wFpdYOXyO4"
    }
  }
}
